<?xml version="1.0" encoding="UTF-8"?>
<!DOCTYPE components PUBLIC "-//DBFLUTE//DTD LastaDi 1.0//EN"
	"http://dbflute.org/meta/lastadi10.dtd">
<components>
	<include path="convention.xml"/>
	<include path="customizer.xml"/>

	<component name="actionCreator" class="org.dbflute.lasta.di.core.creator.ActionCreator"/>
	<component name="assistCreator" class="org.dbflute.lasta.di.core.creator.AssistCreator"/>
	<component name="logicCreator" class="org.dbflute.lasta.di.core.creator.LogicCreator"/>
	<component name="serviceCreator" class="org.dbflute.lasta.di.core.creator.ServiceCreator"/>
	<component name="helperCreator" class="org.dbflute.lasta.di.core.creator.HelperCreator"/>
	<component name="interceptorCreator" class="org.dbflute.lasta.di.core.creator.InterceptorCreator"/>
</components>
